{
  "schema_version": "0.1",
  "meta": {
    "title": "First Light",
    "setter": "vibe-cryptic (hand-set)",
    "date": "2026-08-30",
    "difficulty": "standard",
    "tradition": "us-cryptic",
    "notes": "The calibration fixture: a complete hand-set cryptic in the US blocked style (not the barred style Harper's publishes \u2014 see issue #18). Every device the taxonomy names is represented at least once, and the structured wordplay is populated throughout so the checkers have something to check."
  },
  "grid": {
    "pattern": [
      "...#.......",
      ".#.#.#.#.#.",
      ".......#...",
      ".###.###.#.",
      ".....#.....",
      "##.#.#.#.##",
      ".....#.....",
      ".#.###.###.",
      "...#.......",
      ".#.#.#.#.#.",
      ".......#..."
    ],
    "symmetry": "rotational-180"
  },
  "entries": [
    {
      "number": 1,
      "direction": "across",
      "row": 0,
      "col": 0,
      "answer": "AXE",
      "enumeration": "3",
      "clue": {
        "text": "Sack some of the tax expenditure",
        "definition": {
          "text": "Sack",
          "position": "leading"
        },
        "wordplay": {
          "devices": [
            "hidden"
          ],
          "derivation": "AXE is concealed in 'the tAX Expenditure'.",
          "indicators": [
            "some of"
          ],
          "checks": [
            {
              "kind": "hidden",
              "source": "the tax expenditure",
              "yields": "AXE"
            }
          ]
        }
      },
      "provenance": {
        "stage": "hand",
        "revisions": 0
      }
    },
    {
      "number": 3,
      "direction": "across",
      "row": 0,
      "col": 4,
      "answer": "ACROBAT",
      "enumeration": "7",
      "clue": {
        "text": "Tumbler upset cab rota",
        "definition": {
          "text": "Tumbler",
          "position": "leading"
        },
        "wordplay": {
          "devices": [
            "anagram"
          ],
          "derivation": "Anagram ('upset') of CAB ROTA gives ACROBAT.",
          "indicators": [
            "upset"
          ],
          "checks": [
            {
              "kind": "anagram",
              "fodder": "cab rota",
              "yields": "ACROBAT"
            }
          ]
        }
      },
      "provenance": {
        "stage": "hand",
        "revisions": 0
      }
    },
    {
      "number": 7,
      "direction": "across",
      "row": 2,
      "col": 0,
      "answer": "TRAILED",
      "enumeration": "7",
      "clue": {
        "text": "Model who protested followed",
        "definition": {
          "text": "followed",
          "position": "trailing"
        },
        "wordplay": {
          "devices": [
            "charade"
          ],
          "derivation": "T (Model T) + RAILED (protested) = TRAILED.",
          "checks": [
            {
              "kind": "abbreviation",
              "source": "Model",
              "yields": "T"
            },
            {
              "kind": "literal",
              "source": "protested",
              "yields": "RAILED"
            },
            {
              "kind": "concatenation",
              "parts": [
                "T",
                "RAILED"
              ],
              "yields": "TRAILED"
            }
          ]
        }
      },
      "provenance": {
        "stage": "hand",
        "revisions": 0
      }
    },
    {
      "number": 8,
      "direction": "across",
      "row": 2,
      "col": 8,
      "answer": "LOT",
      "enumeration": "3",
      "clue": {
        "text": "Plenty of land for sale",
        "definition": {
          "text": "Plenty",
          "position": "leading"
        },
        "wordplay": {
          "devices": [
            "double_definition"
          ],
          "derivation": "Double definition: LOT as plenty, and LOT as a parcel of land for sale."
        }
      },
      "provenance": {
        "stage": "hand",
        "revisions": 0
      }
    },
    {
      "number": 9,
      "direction": "across",
      "row": 4,
      "col": 0,
      "answer": "CIGAR",
      "enumeration": "5",
      "clue": {
        "text": "Craig rolled a smoke",
        "definition": {
          "text": "smoke",
          "position": "trailing"
        },
        "wordplay": {
          "devices": [
            "anagram"
          ],
          "derivation": "Anagram ('rolled') of CRAIG gives CIGAR, with 'rolled' doing honest double duty on the surface.",
          "indicators": [
            "rolled"
          ],
          "checks": [
            {
              "kind": "anagram",
              "fodder": "Craig",
              "yields": "CIGAR"
            }
          ]
        }
      },
      "provenance": {
        "stage": "hand",
        "revisions": 0
      }
    },
    {
      "number": 11,
      "direction": "across",
      "row": 4,
      "col": 6,
      "answer": "ATOLL",
      "enumeration": "5",
      "clue": {
        "text": "A charge for the island",
        "definition": {
          "text": "island",
          "position": "trailing"
        },
        "wordplay": {
          "devices": [
            "charade"
          ],
          "derivation": "A + TOLL (charge) = ATOLL.",
          "checks": [
            {
              "kind": "literal",
              "source": "A",
              "yields": "A"
            },
            {
              "kind": "literal",
              "source": "charge",
              "yields": "TOLL"
            },
            {
              "kind": "concatenation",
              "parts": [
                "A",
                "TOLL"
              ],
              "yields": "ATOLL"
            }
          ]
        }
      },
      "provenance": {
        "stage": "hand",
        "revisions": 0
      }
    },
    {
      "number": 12,
      "direction": "across",
      "row": 6,
      "col": 0,
      "answer": "APRON",
      "enumeration": "5",
      "clue": {
        "text": "Cover found in cheap Ronaldo merchandise",
        "definition": {
          "text": "Cover",
          "position": "leading"
        },
        "wordplay": {
          "devices": [
            "hidden"
          ],
          "derivation": "APRON is concealed in 'cheAP RONaldo'.",
          "indicators": [
            "found in"
          ],
          "checks": [
            {
              "kind": "hidden",
              "source": "cheap Ronaldo",
              "yields": "APRON"
            }
          ]
        }
      },
      "provenance": {
        "stage": "hand",
        "revisions": 0
      }
    },
    {
      "number": 13,
      "direction": "across",
      "row": 6,
      "col": 6,
      "answer": "BANJO",
      "enumeration": "5",
      "clue": {
        "text": "Strings involved in a suburban job",
        "definition": {
          "text": "Strings",
          "position": "leading"
        },
        "wordplay": {
          "devices": [
            "hidden"
          ],
          "derivation": "BANJO is concealed in 'subur BAN JOb'.",
          "indicators": [
            "involved in"
          ],
          "checks": [
            {
              "kind": "hidden",
              "source": "a suburban job",
              "yields": "BANJO"
            }
          ]
        }
      },
      "provenance": {
        "stage": "hand",
        "revisions": 0
      }
    },
    {
      "number": 15,
      "direction": "across",
      "row": 8,
      "col": 0,
      "answer": "LEA",
      "enumeration": "3",
      "clue": {
        "text": "Endless lead for the meadow",
        "definition": {
          "text": "meadow",
          "position": "trailing"
        },
        "wordplay": {
          "devices": [
            "deletion"
          ],
          "derivation": "LEAD without its last letter ('endless') gives LEA.",
          "indicators": [
            "Endless"
          ],
          "checks": [
            {
              "kind": "deletion",
              "source": "lead",
              "remove": "D",
              "yields": "LEA"
            }
          ]
        }
      },
      "provenance": {
        "stage": "hand",
        "revisions": 0
      }
    },
    {
      "number": 16,
      "direction": "across",
      "row": 8,
      "col": 4,
      "answer": "MATINEE",
      "enumeration": "7",
      "clue": {
        "text": "Main tee redesigned for the afternoon show",
        "definition": {
          "text": "afternoon show",
          "position": "trailing"
        },
        "wordplay": {
          "devices": [
            "anagram"
          ],
          "derivation": "Anagram ('redesigned') of MAIN TEE gives MATINEE.",
          "indicators": [
            "redesigned"
          ],
          "checks": [
            {
              "kind": "anagram",
              "fodder": "Main tee",
              "yields": "MATINEE"
            }
          ]
        }
      },
      "provenance": {
        "stage": "hand",
        "revisions": 0
      }
    },
    {
      "number": 18,
      "direction": "across",
      "row": 10,
      "col": 0,
      "answer": "SIDECAR",
      "enumeration": "7",
      "clue": {
        "text": "Team vehicle makes a cocktail",
        "definition": {
          "text": "cocktail",
          "position": "trailing"
        },
        "wordplay": {
          "devices": [
            "charade"
          ],
          "derivation": "SIDE (team) + CAR (vehicle) = SIDECAR, the cocktail.",
          "checks": [
            {
              "kind": "literal",
              "source": "Team",
              "yields": "SIDE"
            },
            {
              "kind": "literal",
              "source": "vehicle",
              "yields": "CAR"
            },
            {
              "kind": "concatenation",
              "parts": [
                "SIDE",
                "CAR"
              ],
              "yields": "SIDECAR"
            }
          ]
        }
      },
      "provenance": {